title,link,published
"Shares to buy in short term: Mehta Equities’ Riyank suggests Bharti Airtel, Motilal Oswal, Paytm stock to buy",https://www.livemint.com/market/stock-market-news/shares-to-buy-in-short-term-mehta-equities-riyank-suggests-bharti-airtel-motilal-oswal-paytm-stock-to-buy-11761193845767.html,2025-10-23
"Infosys, TCS, HCL Tech, other IT stocks jump up to 3% amid India-US trade deal buzz",https://www.livemint.com/market/stock-market-news/infosys-tcs-hcl-tech-other-it-stocks-jump-up-to-3-amid-india-us-trade-deal-buzz-11761193733822.html,2025-10-23
Infosys share price jumps over 4% after promoters opt out of share buyback,https://www.livemint.com/market/infosys-share-price-jumps-over-3-after-promoters-opt-out-of-share-buyback-11761193060260.html,2025-10-23
"Sensex jumps over 700 points, Nifty 50 above 26,000; why is Indian stock market rising today? 5 key reasons",https://www.livemint.com/market/stock-market-news/sensex-jumps-over-700-points-nifty-50-above-26-000-why-is-indian-stock-market-rising-today-5-key-reasons-11761190330635.html,2025-10-23
Gold price today: MCX gold rate rises to near  ₹1.23 lakh per 10 gms; silver prices jump 1%; US-China trade deal eyed,https://www.livemint.com/market/commodities/gold-price-today-mcx-gold-rate-rises-near-rs-1-23-lakh-per-10-gms-silver-prices-jump-1-us-china-trade-deal-eyed-11761190580813.html,2025-10-23
"Q2 Results today: HUL, Colgate Palmolive, PTC India, others to announce Q2 earnings",https://www.livemint.com/market/stock-market-news/q2-results-today-hul-colgate-palmolive-ptc-india-others-to-announce-q2-earnings-11761188103587.html,2025-10-23
Rupee set to open higher after Diwali break; focus on US-India trade deal news flow,https://www.livemint.com/market/stock-market-news/rupee-set-to-open-higher-after-diwali-break-focus-on-us-india-trade-deal-news-flow-11761188371658.html,2025-10-23
"Nifty 50, Sensex today: What to expect from Indian stock market in trade on October 23 amid India-US trade deal buzz",https://www.livemint.com/market/stock-market-news/nifty-50-sensex-today-what-to-expect-from-indian-stock-market-in-trade-on-october-23-amid-india-us-trade-deal-buzz-11761159893879.html,2025-10-23
"Indian stock market: 10 things that changed for market - Gift Nifty, India-US trade deal buzz to Russian oil sanctions",https://www.livemint.com/market/stock-market-news/indian-stock-market-10-things-that-changed-for-market-gift-nifty-india-us-trade-deal-buzz-to-russian-oil-sanctions-11761160139971.html,2025-10-23
S.Korean shares track Wall Street lower; investors await BOK governors remarks,https://www.livemint.com/market/stock-market-news/skorean-shares-track-wall-street-lower-investors-await-bok-governors-remarks-11761182204443.html,2025-10-23
Gold Extends Pullback from Record High for a Third Day,https://www.livemint.com/market/commodities/gold-extends-pullback-from-record-high-for-a-third-day-11761180501714.html,2025-10-23
Buy or sell: Vaishali Parekh recommends three stocks to buy today - 23 October 2025,https://www.livemint.com/market/stock-market-news/buy-or-sell-vaishali-parekh-recommends-three-stocks-to-buy-today-23-october-2025-11761137793327.html,2025-10-23
"Stock market today: Trade setup for Nifty 50, Gift Nifty to India-US trade deal; 8 stocks to buy",https://www.livemint.com/market/stock-market-news/stock-market-today-trade-setup-for-nifty-50-gift-nifty-to-india-us-trade-deal-8-stocks-to-buy-11761148296141.html,2025-10-23
"Ceat investors ride high on prospects even as Camso integration, debt spike pinch",https://www.livemint.com/market/mark-to-market/ceat-q2-earnings-ceat-share-price-tyre-companies-india-camso-construction-11761118548896.html,2025-10-23
Stocks to trade today: Trade Brains Portal recommends two stocks for 23 October,https://www.livemint.com/market/stock-market-news/stocks-to-trade-trade-brains-portal-stock-recommendations-23-october-sensex-nifty-11761134877633.html,2025-10-23
Stock recommendations for 23 October from MarketSmith India,https://www.livemint.com/market/stock-market-news/stock-recommendations-23-october-marketsmith-india-sensex-nifty-market-setup-11761133857869.html,2025-10-23
